{
  "track_id": "22222222-2222-4222-8222-222222222222",
  "positions": [
    { "lat": 37.7749, "lon": -122.4194, "alt": 20.0, "timestamp": "2025-01-01T12:00:00Z" },
    { "lat": 37.7755, "lon": -122.4189, "alt": 22.0, "timestamp": "2025-01-01T12:00:10Z" }
  ],
  "velocity": { "speed_mps": 2.5, "heading_deg": 135 },
  "classification": "fire",
  "confidence": 0.85
}
